{
  "contractVersion": "orion.research.v1",
  "researchRunId": "11111111-1111-4111-8111-111111111111",
  "archiveId": "22222222-2222-4222-8222-222222222222",
  "title": "Research methods",
  "description": null,
  "objective": "Compare documented research methods",
  "settings": {
    "dateFrom": null,
    "dateTo": null,
    "languages": ["en"],
    "preferredDomains": [],
    "excludedDomains": [],
    "config": {},
    "updatedAt": "2026-10-18T08:00:00Z"
  }
}
